{
  "schemaVersion": 1,
  "kind": "production",
  "status": "inconclusive",
  "outcome": "inconclusive",
  "lifecycle": { "state": "inconclusive" },
  "externalConsequence": {
    "outcome": "unavailable",
    "target": "replace with stable alias and immutable deployment"
  },
  "candidate": {
    "repositoryCommit": "aaaaaaaaaaaaaaaaaaaaaaaaaaaaaaaaaaaaaaaa",
    "sourceDigest": "aaaaaaaaaaaaaaaaaaaaaaaaaaaaaaaaaaaaaaaaaaaaaaaaaaaaaaaaaaaaaaaa",
    "artifactDigest": "bbbbbbbbbbbbbbbbbbbbbbbbbbbbbbbbbbbbbbbbbbbbbbbbbbbbbbbbbbbbbbbb"
  },
  "authority": {
    "principal": "approved production reader",
    "identitySource": "target-owned approval",
    "externalAccess": "read_only",
    "approvalReceipt": "replace with approval receipt",
    "rollbackOwner": "Vercel deployment owner"
  },
  "environment": {
    "tier": "production",
    "target": "replace with stable alias and immutable deployment"
  },
  "journeyResults": [
    {
      "journeyId": "BND-J09-deployment-promotion-readback",
      "status": "inconclusive",
      "oracle": "Replace with the live, readback-backed oracle."
    }
  ],
  "commandReceipt": {
    "invocation": "run the target-owned production proof procedure",
    "outcome": "blocked",
    "exitCode": null,
    "invariant": "Production requires fresh immutable deployment and alias readbacks.",
    "target": "replace with Production deployment",
    "recoveryHint": "Attach fresh target readback and rollback references.",
    "detailPath": "docs/evidence/verification/details/replace-me.json",
    "detailSha256": "cccccccccccccccccccccccccccccccccccccccccccccccccccccccccccccccc",
    "postcondition": "No Production result is established."
  },
  "externalReadback": {
    "required": true,
    "outcome": "unavailable",
    "receipt": "replace with sanitized target readback or unavailable receipt"
  },
  "postconditions": [
    "No Production claim is established while readback is unavailable."
  ],
  "limitations": [
    "A stable hostname, source build, or Preview result is not Production proof."
  ],
  "nonClaims": [
    "This template does not prove deployment, promotion, message delivery, or provider health."
  ],
  "rollback": {
    "identity": "replace with current and previous immutable deployment references",
    "outcome": "unavailable",
    "owner": "Vercel deployment owner"
  },
  "evidence": [
    {
      "path": "docs/evidence/verification/details/replace-me.json",
      "sha256": "cccccccccccccccccccccccccccccccccccccccccccccccccccccccccccccccc",
      "provenance": "replace with retained sanitized detail"
    }
  ],
  "observedAt": "2026-07-21T00:00:00.000Z"
}
