{
  "schemaVersion": 1,
  "kind": "messaging",
  "status": "inconclusive",
  "outcome": "not_attempted",
  "lifecycle": { "state": "inconclusive" },
  "externalConsequence": {
    "outcome": "not_attempted",
    "target": "replace with exact Sendblue account, line, and webhook"
  },
  "candidate": {
    "repositoryCommit": "aaaaaaaaaaaaaaaaaaaaaaaaaaaaaaaaaaaaaaaa",
    "sourceDigest": "aaaaaaaaaaaaaaaaaaaaaaaaaaaaaaaaaaaaaaaaaaaaaaaaaaaaaaaaaaaaaaaa",
    "artifactDigest": "bbbbbbbbbbbbbbbbbbbbbbbbbbbbbbbbbbbbbbbbbbbbbbbbbbbbbbbbbbbbbbbb"
  },
  "authority": {
    "principal": "approved Sendblue operator",
    "identitySource": "target-owned approval",
    "externalAccess": "mutation",
    "approvalReceipt": "replace with message authority receipt",
    "rollbackOwner": "Sendblue account owner"
  },
  "environment": {
    "tier": "external",
    "target": "replace with exact Sendblue account, line, and webhook"
  },
  "journeyResults": [
    {
      "journeyId": "BND-J05-sendblue-accepted-message",
      "status": "inconclusive",
      "oracle": "Replace with a sanitized provider acceptance and consequence oracle."
    }
  ],
  "commandReceipt": {
    "invocation": "run the named Sendblue operation after its authority gate",
    "outcome": "blocked",
    "exitCode": null,
    "invariant": "A send requires exact recipient-safe target, approval, and rollback.",
    "target": "replace with exact Sendblue target",
    "recoveryHint": "Attach authority and readback; otherwise stop without sending.",
    "detailPath": "docs/evidence/verification/details/replace-me.json",
    "detailSha256": "cccccccccccccccccccccccccccccccccccccccccccccccccccccccccccccccc",
    "postcondition": "No message is sent by this template."
  },
  "externalReadback": {
    "required": true,
    "outcome": "unavailable",
    "receipt": "replace with sanitised account/webhook readback"
  },
  "postconditions": ["No external messaging consequence is established."],
  "limitations": [
    "Provider acceptance and recipient delivery are different claims."
  ],
  "nonClaims": [
    "This template contains no message content and proves no delivery."
  ],
  "rollback": {
    "identity": "replace with provider-owned rollback identity",
    "outcome": "unavailable",
    "owner": "Sendblue account owner"
  },
  "evidence": [
    {
      "path": "docs/evidence/verification/details/replace-me.json",
      "sha256": "cccccccccccccccccccccccccccccccccccccccccccccccccccccccccccccccc",
      "provenance": "replace with retained sanitised detail"
    }
  ],
  "observedAt": "2026-07-21T00:00:00.000Z"
}
